{
  "protocol": "ownmesh.device/1.0",
  "message_id": "msg_01OPREQ",
  "type": "operation.request",
  "device_id": "dev_windows-01",
  "correlation_id": "op_01REMOTE",
  "seq": 124,
  "sent_at": "2026-08-06T00:00:00Z",
  "expires_at": "2026-08-06T00:01:00Z",
  "payload": {
    "operation_contract": "ownmesh.operation/1.0",
    "operation_id": "op_01REMOTE",
    "capability": "fs.read",
    "workspace_id": "ws_app",
    "idempotency_key": "idem_remote_read_01",
    "arguments": {
      "path": "README.md",
      "max_bytes": 65536
    }
  }
}
